{
  "$schema": "../schemas/skill.schema.json",
  "id": "persuasion",
  "name": "Persuasion",
  "description": "The art of making people agree with you — through charm, logic, or knowing which buttons to press.",
  "category": "social",
  "governing_attribute": "charisma",
  "max_level": 20,
  "xp_per_level": 100,
  "tags": ["social", "dialogue", "reputation"]
}
